{"$schema":"https://json-schema.org/draft/2020-12/schema","$id":"https://mtl-archives.local/authoring-input.schema.v1.json","type":"object","additionalProperties":false,"required":["schema_version","artifact_id","families","sources","records","claims","unresolved"],"properties":{"schema_version":{"const":"ground_authoritative_research_v1.5.0"},"artifact_id":{"const":"ground-authoritative-research-v1"},"families":{"type":"array","minItems":1,"items":{"$ref":"#/$defs/family"}},"sources":{"type":"array","minItems":1,"items":{"$ref":"#/$defs/source"}},"records":{"type":"array","minItems":6,"maxItems":6,"items":{"$ref":"#/$defs/record"}},"claims":{"type":"array","minItems":6,"items":{"$ref":"#/$defs/claim"}},"unresolved":{"type":"array","minItems":6,"items":{"$ref":"#/$defs/unresolved"}}},"$defs":{"family":{"type":"object","additionalProperties":false,"required":["family_id","label","independence_rule"],"properties":{"family_id":{"type":"string","minLength":1},"label":{"type":"string","minLength":1},"independence_rule":{"type":"string","minLength":1}}},"source":{"type":"object","additionalProperties":false,"required":["source_id","records","url","publisher","institution","family_id","authority_tier","locator","proposition","note","independence","rights_policy","snapshot_policy","provenance","expected_content"],"properties":{"source_id":{"type":"string","pattern":"^r(0|10|100|101|102|105)-[a-z0-9-]+$"},"records":{"type":"array","minItems":1,"uniqueItems":true,"items":{"enum":[0,10,100,101,102,105]}},"url":{"type":"string","format":"uri"},"publisher":{"type":"string","minLength":1},"institution":{"type":"string","minLength":1},"family_id":{"type":"string","minLength":1},"authority_tier":{"enum":["primary_contemporary","official_authority","official_context","context_only"]},"locator":{"type":"string","minLength":1},"proposition":{"type":"string","minLength":1},"note":{"type":"string","minLength":1},"independence":{"enum":["independent","family_limited"]},"rights_policy":{"type":"string","minLength":1},"snapshot_policy":{"enum":["bounded_transcription_only","compact_official_capture","lead_only_no_snapshot","predecessor_reference_only"]},"provenance":{"type":"object","additionalProperties":false,"required":["mode","authored_by","exact_locator","review_status"],"properties":{"mode":{"enum":["manual_bounded_transcription","online_marker_required","online_transport_context","predecessor_metadata","lead_only"]},"authored_by":{"enum":["researcher","predecessor_artifact"]},"exact_locator":{"type":"string","minLength":1},"review_status":{"const":"pending_separate_review"},"predecessor_path":{"type":"string","pattern":"^docs/"},"predecessor_sha256":{"type":"string","pattern":"^[a-f0-9]{64}$"},"predecessor_numeric_id":{"type":"integer","minimum":0},"predecessor_row_sha256":{"type":"string","pattern":"^[a-f0-9]{64}$"}}},"expected_content":{"type":"object","additionalProperties":false,"required":["policy","allowed_content_types","marker_concepts"],"properties":{"policy":{"enum":["manual_locator_only","markers_required","transport_only_not_evidence","predecessor_hash_bound","lead_only"]},"allowed_content_types":{"type":"array","uniqueItems":true,"items":{"enum":["text/html","application/pdf"]}},"marker_concepts":{"type":"array","uniqueItems":true,"items":{"type":"object","additionalProperties":false,"required":["concept_id","alternatives"],"properties":{"concept_id":{"type":"string","pattern":"^[a-z0-9-]+$"},"alternatives":{"type":"array","minItems":1,"uniqueItems":true,"items":{"type":"string","minLength":1}}}}}}}}},"record":{"type":"object","additionalProperties":false,"required":["record_id","scope","required_preservations","forbidden_assertions","source_ids"],"properties":{"record_id":{"enum":[0,10,100,101,102,105]},"scope":{"const":"research_capture_only"},"required_preservations":{"type":"array","minItems":2,"uniqueItems":true,"items":{"type":"string","minLength":1}},"forbidden_assertions":{"type":"array","minItems":1,"uniqueItems":true,"items":{"type":"string","minLength":1}},"source_ids":{"type":"array","minItems":1,"uniqueItems":true,"items":{"type":"string","minLength":1}}}},"claim":{"type":"object","additionalProperties":false,"required":["claim_id","record_id","claim_text","supporting_source_ids","contradicting_source_ids","alternatives_and_limits"],"properties":{"claim_id":{"type":"string","pattern":"^c[0-9]+-[a-z0-9-]+$"},"record_id":{"enum":[0,10,100,101,102,105]},"claim_text":{"type":"string","minLength":1},"supporting_source_ids":{"type":"array","minItems":1,"uniqueItems":true,"items":{"type":"string","minLength":1}},"contradicting_source_ids":{"type":"array","uniqueItems":true,"items":{"type":"string","minLength":1}},"alternatives_and_limits":{"type":"array","minItems":1,"items":{"type":"string","minLength":1}}}},"unresolved":{"type":"object","additionalProperties":false,"required":["lead_id","record_id","kind","description","source_ids"],"properties":{"lead_id":{"type":"string","pattern":"^u[0-9]+-[a-z0-9-]+$"},"record_id":{"enum":[0,10,100,101,102,105]},"kind":{"enum":["contradiction","unresolved_lead"]},"description":{"type":"string","minLength":1},"source_ids":{"type":"array","minItems":1,"uniqueItems":true,"items":{"type":"string","minLength":1}}}}}}
