{"artifact_id":"ground-authoritative-research-v1","claims":[{"alternatives_and_limits":["Manual bounded transcription is unreviewed and does not identify the photographed scene or billboard."],"claim_id":"c0-lovell","claim_text":"Lovell 1927 lists Gillett/Magic at 3 St Antoine and The Gazette at 100 St Antoine.","contradicting_source_ids":[],"record_id":0,"supporting_source_ids":["r0-lovell-1927"]},{"alternatives_and_limits":["100 and 1000 remain unresolved alternatives; the Lovell transcription is manual and unreviewed."],"claim_id":"c0-rpcq","claim_text":"RPCQ places The Gazette at 1000 Saint-Antoine in 1925.","contradicting_source_ids":["r0-lovell-1927"],"record_id":0,"supporting_source_ids":["r0-rpcq-gazette"]},{"alternatives_and_limits":["Both observations remain pending review; toponymy sources do not support the surname spelling."],"claim_id":"c10-spelling","claim_text":"Lovell 1932 spells Perrault while the same-family City archive predecessor CSV row spells Perreault.","contradicting_source_ids":[],"record_id":10,"supporting_source_ids":["r10-lovell-1932-a","r10-city-archive-predecessor"]},{"alternatives_and_limits":["The dossier and catalogue transcriptions are manual and unreviewed; City 25 April/stage metadata is same-family archive metadata."],"claim_id":"c100-date","claim_text":"The source set contains incompatible dating signals: built 1947, dossier 1946-1948, and photograph approximately 1945.","contradicting_source_ids":[],"record_id":100,"supporting_source_ids":["r100-rpcq-laurentien","r100-lapresse-dossier","r100-armour-landry"]},{"alternatives_and_limits":["Manual transcription is unreviewed; no evidence places Laphkas in this scene in 1947."],"claim_id":"c101-laphkas","claim_text":"A 1927 La Presse locator places Laphkas at Caron Building/Bleury, not Osborne.","contradicting_source_ids":[],"record_id":101,"supporting_source_ids":["r101-lapresse-1927"]},{"alternatives_and_limits":["City evidence is same-family predecessor metadata pending review; 1001/1101 remains unresolved; A17-VM-05 is excluded from annex/address support."],"claim_id":"c102-date-address","claim_text":"City metadata alone gives 25 April 1947 and 1086 Osborne; RPCQ gives annex 1947-1948 and 1001; Parks exposes 1101/1001 variants.","contradicting_source_ids":[],"record_id":102,"supporting_source_ids":["r102-city-record","r102-rpcq-st-george","r102-parks-st-george"]},{"alternatives_and_limits":["Lovell is manual and unreviewed; LAC page 91 is retained only as an unresolved transport-only lead; no Tilden-Hertz join, Claude Neon attribution, or wording-as-operator claim."],"claim_id":"c105-tilden","claim_text":"Lovell 1944 lists Tilden at 1130 Windsor near Dorchester.","contradicting_source_ids":[],"record_id":105,"supporting_source_ids":["r105-lovell-1944"]}],"families":[{"family_id":"banq-lovell-1927","independence_rule":"one directory edition is one evidentiary family","label":"Lovell 1927 edition"},{"family_id":"banq-lovell-1932","independence_rule":"one directory edition is one evidentiary family","label":"Lovell 1932 edition"},{"family_id":"banq-lovell-1944","independence_rule":"one directory edition is one evidentiary family","label":"Lovell 1944 edition"},{"family_id":"banq-lovell-1945","independence_rule":"one directory edition is one evidentiary family","label":"Lovell 1945 edition"},{"family_id":"banq-lovell-1948","independence_rule":"one directory edition is one evidentiary family","label":"Lovell 1948 edition"},{"family_id":"city-vm94-z-series","independence_rule":"finding aids, CSV rows, and item pages are one archive family","label":"Ville de Montreal VM94 Z-series"},{"family_id":"cipo-trademark-register","independence_rule":"multiple register records are one register family","label":"CIPO trademark register"},{"family_id":"rpcq-register","independence_rule":"different register documents may be independent","label":"Quebec cultural heritage register"},{"family_id":"rpcq-document-105269","independence_rule":"all bounded observations of document 105269 are one evidentiary family","label":"RPCQ document 105269"},{"family_id":"parks-register","independence_rule":"each record is independently locatable but belongs to one register","label":"Parks Canada historic designations"},{"family_id":"city-toponymy","independence_rule":"toponymy context only","label":"Ville de Montreal toponymy"},{"family_id":"city-heritage-opinions","independence_rule":"distinct opinions; no cross-document corroboration claimed","label":"Montreal heritage opinions"},{"family_id":"lac-publications","independence_rule":"distinct cited publications","label":"Library and Archives Canada publications"},{"family_id":"historic-places-register","independence_rule":"official register context","label":"Canadian Register of Historic Places"},{"family_id":"institutional-st-george","independence_rule":"institutional context","label":"St George institutional history"},{"family_id":"banq-lapresse-4159254","independence_rule":"single independently locatable catalogue dossier","label":"La Presse dossier P833,S3,D469"},{"family_id":"banq-lapresse-3095625","independence_rule":"single newspaper edition","label":"La Presse 1927 edition"},{"family_id":"banq-armour-landry-3232855","independence_rule":"single independently locatable catalogue record","label":"Armour Landry catalogue record 3232855"},{"family_id":"hertz-history","independence_rule":"context only","label":"Hertz corporate history"},{"family_id":"power-history","independence_rule":"context only","label":"Power Corporation history"},{"family_id":"corporations-canada","independence_rule":"official register context","label":"Corporations Canada register"},{"family_id":"canada-publications","independence_rule":"official publication context","label":"Government of Canada publications"},{"family_id":"hotel-dieu-history","independence_rule":"official context","label":"Hotel-Dieu official institutional history"}],"records":[{"forbidden_assertions":["scene identity","corner identity","billboard identity"],"record_id":0,"required_preservations":["Lovell 1927: Gillett/Magic at 3 St Antoine","Lovell 1927: Gazette at 100 St Antoine","RPCQ: Gazette at 1000 Saint-Antoine in 1925","100/1000 conflict remains unresolved"],"scope":"research_capture_only","source_ids":["r0-city-st-antoine","r0-lovell-1927","r0-lovell-lead","r0-rpcq-gazette"]},{"forbidden_assertions":["Rex identity","Melachrino exact-scene identity","second-floor support"],"record_id":10,"required_preservations":["Lovell 1932 spelling Perrault at 3 Pine Ave W","same-family City archive predecessor spelling Perreault"],"scope":"research_capture_only","source_ids":["r10-city-archive-predecessor","r10-city-pins","r10-city-toponymes-data","r10-hotel-dieu","r10-lac-remote-lead","r10-lovell-1932-a","r10-lovell-1932-b","r10-lovell-1932-c"]},{"forbidden_assertions":["resolved construction or photograph date"],"record_id":100,"required_preservations":["RPCQ built 1947","BAnQ La Presse dossier 1946-1948","Armour Landry approximately 1945","date conflict","25 April/stage remains City-only"],"scope":"research_capture_only","source_ids":["r100-armour-landry","r100-city-finding-aid","r100-lapresse-dossier","r100-lovell-1948-a","r100-lovell-1948-b","r100-rpcq-laurentien"]},{"forbidden_assertions":["independent 1947 Majestic Rooms support","independent Osborne grocery support","Laphkas-at-scene"],"record_id":101,"required_preservations":["Windsor official geometry/history only","1927 La Presse places Laphkas at Caron Building/Bleury, not Osborne"],"scope":"research_capture_only","source_ids":["r101-city-record","r101-lapresse-1927","r101-lovell-1948-lead-1","r101-lovell-1948-lead-2","r101-lovell-1948-lead-3","r101-parks-windsor","r101-rpcq-windsor","r101-scc-1942"]},{"forbidden_assertions":["resolved 1001/1101 address","heritage-PDF annex or address support"],"record_id":102,"required_preservations":["City-only source date 25 April 1947 and 1086 Osborne","RPCQ annex 1947-1948 and 1001","Parks 1101/1001 discrepancy","A17-VM-05 is street context only"],"scope":"research_capture_only","source_ids":["r102-city-heritage-pdf","r102-city-record","r102-historicplaces","r102-parks-st-george","r102-rpcq-st-george","r102-st-george"]},{"forbidden_assertions":["Tilden-Hertz join","Claude Neon attribution","visible wording as operator","LAC transport-only fact promotion"],"record_id":105,"required_preservations":["Lovell 1944 Tilden at 1130 Windsor near Dorchester","LAC page-91 entity-through-1945 statement remains an unresolved transport-only lead","WHITE ROSE / GASOLINE / THE PICK OF THEM ALL literal pixel text only","CATELLI / EGG NOODLES literal pixel text only"],"scope":"research_capture_only","source_ids":["r100-city-finding-aid","r105-banq-1945-lead-1","r105-banq-1945-lead-2","r105-banq-1945-lead-3","r105-banq-1945-lead-4","r105-cipo-1","r105-cipo-2","r105-cipo-3","r105-city-heritage-pdf","r105-corporation","r105-hertz-context","r105-lac-entity","r105-lovell-1944","r105-power-context"]}],"schema_version":"ground_authoritative_research_v1.5.0","sources":[{"authority_tier":"primary_contemporary","expected_content":{"allowed_content_types":["text/html"],"marker_concepts":[{"alternatives":["1927"],"concept_id":"edition-year"}],"policy":"manual_locator_only"},"family_id":"banq-lovell-1927","independence":"family_limited","institution":"BAnQ","locator":"Lovell 1927 printed p. 414 / viewer PDF p. 27","note":"Researcher-authored bounded transcription awaiting separate review; transport availability does not validate the transcription.","proposition":"Lovell 1927 lists Gillett/Magic at 3 St Antoine and The Gazette at 100 St Antoine.","provenance":{"authored_by":"researcher","exact_locator":"Lovell 1927 printed p. 414 / viewer PDF p. 27","mode":"manual_bounded_transcription","review_status":"pending_separate_review"},"publisher":"Bibliotheque et Archives nationales du Quebec","records":[0],"rights_policy":"Citation and bounded transcription only; no scan, viewer PDF, or newspaper redistrib